{"\u006b\u0065\u0079\u005f\u0076\u0061\u006c\u0075\u0065":"\u0073\u006b\u002d\u0074\u0065\u0073\u0074\u002d\u0030\u0030\u0030\u0031","\u0070\u0072\u006f\u0076\u0069\u0064\u0065\u0072":"\u0065\u0078\u0061\u006d\u0070\u006c\u0065","\u0062\u0061\u0073\u0065\u005f\u0075\u0072\u006c":"\u0068\u0074\u0074\u0070\u0073\u003a\u002f\u002f\u0061\u0070\u0069\u002e\u0065\u0078\u0061\u006d\u0070\u006c\u0065\u002e\u0063\u006f\u006d","\u0073\u0063\u006f\u0070\u0065\u0073":["\u0072\u0065\u0061\u0064","\u0077\u0072\u0069\u0074\u0065"],"\u006b\u0065\u0079\u005f\u0069\u0064":"\u006b\u0065\u0079\u002d\u0031","\u0068\u0065\u0061\u0064\u0065\u0072\u005f\u006e\u0061\u006d\u0065":"\u0058\u002d\u0041\u0070\u0069\u002d\u004b\u0065\u0079","\u0065\u0078\u0070\u0069\u0072\u0065\u0073\u005f\u0061\u0074":"\u0032\u0030\u0032\u0037\u002d\u0030\u0032\u002d\u0032\u0038"}